{
  "$schema": "https://json-schema.org/draft/2020-12/schema",
  "$id": "https://example.com/schemas/project.schema.json",
  "title": "Game config",
  "description": "Game configuration",
  "type": "object",
  "required": ["title", "description", "version", "route"],
  "properties": {
    "$schema": {
      "type": "string",
      "description": "The schema to verify this config against."
    },
    "title": {
      "type": "string",
      "description": "Game title"
    },
    "description": {
      "type": "string",
      "description": "Game description"
    },
    "version": {
      "type": "string",
      "description": "Game version"
    },
    "route": {
      "type": "string",
      "description": "Path that will be used to access the game"
    },
    "icon": {
      "type": "string",
      "description": "Path to game icon"
    },
    "enabled": {
      "type": "boolean",
      "description": "Add game to bundle",
      "default": true
    },
    "order": {
      "type": "number",
      "description": "Sort order in the wrapper list (higher = earlier). Games without an order sort last, alphabetically by title."
    }
  },
  "additionalProperties": true
}
