{
  "$schema": "../../../packages/shared/schemas/game.schema.json",
  "title": "BOIDS SIMULATION",
  "description": "A boids simulation is a simple algorithm that creates realistic flocking behavior (like birds, fish, or crowds) using a few local rules.",
  "version": "1.0.1",
  "route": "boids-simulation",
  "icon": "icon.png",
  "enabled": true
}