{
  "$schema": "../../../packages/shared/schemas/game.schema.json",
  "title": "PLINKO",
  "description": "Stake-style Plinko: drop balls through pegs into bins, with bet, difficulty, rows, autoplay and history.",
  "version": "1.6.1",
  "route": "plinko",
  "order": 7,
  "icon": "icon.png",
  "enabled": true
}
