{
  "$schema": "../../../packages/shared/schemas/game.schema.json",
  "title": "CONNECT 4",
  "description": "Drop discs to line up four in a row — vertical, horizontal, or diagonal. Play head-to-head or against the AI.",
  "version": "1.1.0",
  "route": "connect-4",
  "icon": "icon.png",
  "order": 5,
  "enabled": true
}
