{
  "$schema": "../../../packages/shared/schemas/game.schema.json",
  "title": "STAR BATTLE",
  "description": "Logic puzzle: place stars in every row, column and colored region — but no two may touch.",
  "version": "0.5.7",
  "route": "star-battle",
  "order": 4,
  "icon": "icon.png",
  "enabled": true
}
