{
  "$schema": "../../../packages/shared/schemas/game.schema.json",
  "title": "CONNECT DOTS",
  "description": "Link each matching color pair, fill the whole grid, and untangle increasingly dense Numberlink-style boards.",
  "version": "0.0.3",
  "route": "connect-dots",
  "icon": "icon.svg",
  "enabled": true
}
